{
 "$schema": "./so101.schema.json",
 "meta": {
  "robot": "so101",
  "generated": "2026-10-30",
  "fx_czk_per_eur": 24.2,
  "fx_ron_per_eur": 5.09,
  "fx_note": "Assumption: CNB daily rate not fetched; update before use.",
  "source": "Component map 2026-10-29 (sources with check date and status). We are not a seller: users buy directly from suppliers.",
  "status_legend": {
   "verified": "seen on the source page on the checked date",
   "carried": "from our 27 Oct BOM sheet, not re-opened",
   "unverified": "not seen; inferred or page silent",
   "estimate": "our assumption"
  },
  "oss_vat_uplift": 0.017,
  "affiliate_links": false,
  "license": {
   "hw": "Apache-2.0",
   "sw": "Apache-2.0",
   "status": "verified",
   "checked": "2026-10-30",
   "sources": ["https://github.com/TheRobotStudio/SO-ARM100/blob/main/LICENSE", "https://github.com/huggingface/lerobot/blob/main/LICENSE"]
  }
 },
 "suppliers": {
  "eckstein": {
   "name": "Eckstein",
   "country": "DE",
   "url": "https://eckstein-shop.de/",
   "vat": "eu_oss",
   "shipping_eur": [
    8,
    15
   ],
   "shipping_status": "estimate"
  },
  "openelab": {
   "name": "OpenELAB",
   "country": "DE/CN",
   "url": "https://openelab.io/",
   "vat": "eu_oss",
   "shipping_eur": [
    5,
    10
   ],
   "shipping_status": "estimate",
   "eta_days_estimate": [
    5,
    21
   ],
   "eta_note": "Warehouse not stated: China warehouse if EU stock is out."
  },
  "alza": {
   "name": "Alza",
   "country": "CZ",
   "url": "https://www.alza.cz/",
   "vat": "cz",
   "shipping_eur": [
    0,
    3
   ],
   "shipping_status": "estimate"
  },
  "hornbach": {
   "name": "Hornbach CZ",
   "country": "CZ",
   "url": "https://www.hornbach.cz/",
   "vat": "cz",
   "shipping_eur": [
    0,
    4
   ],
   "shipping_status": "estimate"
  },
  "aliexpress": {
   "name": "AliExpress",
   "country": "CN",
   "url": "https://www.aliexpress.com/",
   "vat": "cn_ioss",
   "shipping_eur": [
    0,
    0
   ],
   "duty_eur_per_line": 3,
   "shipping_status": "estimate"
  },
  "sigmanortec": {
   "name": "Sigmanortec",
   "country": "RO",
   "url": "https://sigmanortec.ro/",
   "vat": "eu_oss",
   "shipping_eur": [
    8,
    15
   ],
   "shipping_status": "estimate"
  },
  "amazon_fr": {
   "name": "Amazon.fr",
   "country": "FR",
   "url": "https://www.amazon.fr/",
   "vat": "eu_oss",
   "shipping_eur": [
    0,
    8
   ],
   "shipping_status": "estimate",
   "eta_days_estimate": [
    3,
    7
   ]
  },
  "prusa": {
   "name": "Prusa Center (Praha)",
   "country": "CZ",
   "url": "https://www.prusa3d.com/cs/stranka/zakazkovy-3d-tisk-na-miru_240720/",
   "vat": "cz",
   "shipping_eur": [
    4,
    4
   ],
   "shipping_status": "verified",
   "shipping_note": "99 Kč CZ shipping (verified 2026-10-29)"
  },
  "craftcloud": {
   "name": "Craftcloud",
   "country": "DE",
   "url": "https://craftcloud3d.com",
   "vat": "per_vendor",
   "shipping_eur": [
    0,
    15
   ],
   "shipping_status": "estimate"
  },
  "none": {
   "name": "Included with servos",
   "name_cs": "Součást balení serv",
   "country": "—",
   "url": "https://github.com/TheRobotStudio/SO-ARM100",
   "vat": "none",
   "shipping_eur": [
    0,
    0
   ],
   "shipping_status": "verified",
   "eta_days_estimate": [
    0,
    0
   ]
  }
 },
 "variants": {
  "codes": {
   "C001": {
    "voltage_v": 7.4,
    "gear_ratio": "1/345",
    "status": "verified"
   },
   "C044": {
    "voltage_v": 7.4,
    "gear_ratio": "1/191",
    "status": "verified"
   },
   "C046": {
    "voltage_v": 7.4,
    "gear_ratio": "1/147",
    "status": "verified"
   },
   "C018": {
    "voltage_v": 12,
    "gear_ratio": "1/345",
    "status": "verified"
   },
   "C047": {
    "voltage_v": 12,
    "gear_ratio": "1/345",
    "status": "unverified"
   }
  },
  "arms": {
   "follower_12v": {
    "voltage_v": 12,
    "joints": [
     {
      "joint": 1,
      "name": "shoulder_pan",
      "codes": [
       "C018",
       "C047"
      ]
     },
     {
      "joint": 2,
      "name": "shoulder_lift",
      "codes": [
       "C018",
       "C047"
      ]
     },
     {
      "joint": 3,
      "name": "elbow_flex",
      "codes": [
       "C018",
       "C047"
      ]
     },
     {
      "joint": 4,
      "name": "wrist_flex",
      "codes": [
       "C018",
       "C047"
      ]
     },
     {
      "joint": 5,
      "name": "wrist_roll",
      "codes": [
       "C018",
       "C047"
      ]
     },
     {
      "joint": 6,
      "name": "gripper",
      "codes": [
       "C018",
       "C047"
      ]
     }
    ]
   },
   "leader": {
    "voltage_v": 7.4,
    "joints": [
     {
      "joint": 1,
      "name": "shoulder_pan",
      "codes": [
       "C044"
      ]
     },
     {
      "joint": 2,
      "name": "shoulder_lift",
      "codes": [
       "C001"
      ]
     },
     {
      "joint": 3,
      "name": "elbow_flex",
      "codes": [
       "C044"
      ]
     },
     {
      "joint": 4,
      "name": "wrist_flex",
      "codes": [
       "C046"
      ]
     },
     {
      "joint": 5,
      "name": "wrist_roll",
      "codes": [
       "C046"
      ]
     },
     {
      "joint": 6,
      "name": "gripper",
      "codes": [
       "C046"
      ]
     }
    ]
   }
  },
  "rules": [
   "Never mix 12 V and 7.4 V servos on one bus or power supply.",
   "The gear ratio is printed only on the label and listing; listings can be wrong (OpenELAB shows C001 as 1/191)."
  ],
  "rules_cs": [
   "Nikdy nemíchejte 12V a 7,4V serva na jedné sběrnici ani jednom zdroji.",
   "Převod je jen na štítku a v inzerátu; inzeráty bývají chybné (OpenELAB uvádí C001 jako 1/191)."
  ],
  "how_to_verify": [
   "On the listing, find the exact code (C018, C001, C044, C046) together with voltage and gear ratio; with a variant selector, check the selected option, not the title.",
   "When the servos arrive, read the label on every servo before setting IDs and sort them by joint.",
   "In the servo wizard, the model and voltage are checked before IDs are written."
  ],
  "how_to_verify_cs": [
   "V inzerátu najděte přesný kód (C018, C001, C044, C046) spolu s napětím a převodem; u výběru variant kontrolujte zvolenou možnost, ne nadpis.",
   "Po doručení přečtěte štítek na každém servu ještě před nastavením ID a roztřiďte je podle kloubů.",
   "V průvodci nastavením serv se model a napětí kontrolují před zápisem ID."
  ]
 },
 "configs": {
  "follower_12v": {
   "name": "Follower only, 12 V",
   "name_cs": "Jen follower, 12 V",
   "arms": [
    "follower_12v"
   ],
   "lines": [
    {
     "component": "so101.servo.c018",
     "qty": 6,
     "source": "eckstein",
     "arm": "follower_12v"
    },
    {
     "component": "so101.bus_board",
     "qty": 1,
     "source": "eckstein"
    },
    {
     "component": "so101.psu_12v",
     "qty": 1,
     "source": "eckstein"
    },
    {
     "component": "so101.usb_c",
     "qty": 1,
     "source": "alza"
    },
    {
     "component": "so101.clamps",
     "qty": 2,
     "source": "hornbach"
    },
    {
     "component": "so101.fasteners",
     "qty": 1,
     "source": "none"
    }
   ],
   "print_grams": 350
  },
  "pair": {
   "name": "Pair: leader + follower (12 V follower)",
   "name_cs": "Pár: leader + follower (follower 12 V)",
   "arms": [
    "follower_12v",
    "leader"
   ],
   "lines": [
    {
     "component": "so101.servo.c018",
     "qty": 6,
     "source": "eckstein",
     "arm": "follower_12v"
    },
    {
     "component": "so101.servo.c001",
     "qty": 1,
     "source": "eckstein",
     "arm": "leader"
    },
    {
     "component": "so101.servo.c044",
     "qty": 2,
     "source": "openelab",
     "arm": "leader"
    },
    {
     "component": "so101.servo.c046",
     "qty": 3,
     "source": "eckstein",
     "arm": "leader"
    },
    {
     "component": "so101.bus_board",
     "qty": 2,
     "source": "eckstein"
    },
    {
     "component": "so101.psu_12v",
     "qty": 1,
     "source": "eckstein"
    },
    {
     "component": "so101.psu_5v",
     "qty": 1,
     "source": "eckstein"
    },
    {
     "component": "so101.usb_c",
     "qty": 2,
     "source": "alza"
    },
    {
     "component": "so101.clamps",
     "qty": 4,
     "source": "hornbach"
    },
    {
     "component": "so101.fasteners",
     "qty": 1,
     "source": "none"
    }
   ],
   "print_grams": 700,
   "alternative": {
    "component": "so101.bundle.seeed_pro",
    "source": "aliexpress",
    "note": "One parcel with the official Seeed mix of servos (lowest wrong-variant risk). Ships from China: 2–4 weeks.",
    "note_cs": "Jeden balík s oficiální sestavou serv od Seeedu (nejnižší riziko špatné varianty). Posílá se z Číny: 2–4 týdny."
   }
  }
 },
 "printing": {
  "self": {
   "filament_czk_per_kg": 450,
   "status": "estimate",
   "note": "PLA+ (README); 0.4 mm nozzle at 0.2 mm layers, 15 % infill, supports.",
   "note_cs": "PLA+ (README); tryska 0,4 mm, vrstva 0,2 mm, výplň 15 %, podpory.",
   "stl_url": "https://github.com/TheRobotStudio/SO-ARM100"
  },
  "service": {
   "price_eur_per_arm": [
    30,
    75
   ],
   "status": "estimate",
   "eta_days": [
    5,
    14
   ],
   "sources": [
    "prusa",
    "craftcloud"
   ],
   "note": "Price not published for this part set: upload the STLs for a quote. Range is our estimate.",
   "note_cs": "Cena pro tuto sadu dílů není zveřejněná: nahrajte STL a nechte si udělat nabídku. Rozpětí je náš odhad."
  }
 },
 "tools": [
  {
   "id": "screwdrivers",
   "name": "Phillips screwdrivers #0 and #1 (README: highly recommended)",
   "name_cs": "Křížové šroubováky #0 a #1 (README: velmi doporučeno)",
   "required": true
  },
  {
   "id": "pc",
   "name": "Computer with USB and Python 3.10+ (LeRobot)",
   "name_cs": "Počítač s USB a Pythonem 3.10+ (LeRobot)",
   "required": true
  },
  {
   "id": "printer",
   "name": "3D printer, ≥ 220 × 220 mm bed, PLA+",
   "name_cs": "3D tiskárna s podložkou ≥ 220 × 220 mm, PLA+",
   "required": true,
   "only_print": "self"
  },
  {
   "id": "cutters",